,AgencyName,LegalStatus,OfficePhone,EMail,Website,Address,Neighbourhood,Accessibility,Hours,Eligibility,Languages,Application,DescriptionService,DateUpdated
47,Centre for Addiction and Mental Health,(50) Non Profit ; (51) Registered Charity,Access CAMH (Intake Assessment) 416-535-8501 ext 2,,www.camh.ca,"The Carlos Fidani Family Building
60 White Squirrel Way, 4th Fl
Toronto, ON     M6J 1H4","Niagara, 82",Designated parking at entrance ; Wheelchair accessible automatic main entrance ; Barrier-free washroom including door and stall,Mon-Fri 9 am-5 pm,Individuals 18 years and older with alcohol and drug addiction problems,English ; Access to trained interpreters available for French and other languages,No referral necessary but assessment required -- call Access CAMH * existing clients call 416-535-8501 ext 34430,"Addiction assessment and treatment including day and residential programs * psychoeducation and relapse prevention<br> <br> 

<b>Brief Treatment Service</b> -- group or individual intervention to help people abstain or moderate their substance use to non-harmful levels * relapse prevention * nutritional counselling * stress management training * consultation</b><br><br>

<b>Family Service</b> -- treatment and support for anyone concerned with the substance use of someone else, who may or may not be in treatment at CAMH * individual and group formats * education and consultation * family and couple counselling available to CAMH clients and their families",2015-04-16
48,Centre for Addiction and Mental Health,(50) Non Profit ; (51) Registered Charity,Access CAMH (Intake Assessment) 416-535-8501 ext 2 ; Inquiries 416-535-8501 ext 36019,,www.camh.ca,"Bell Gateway Building
100 Stokes St, 3rd Fl
Toronto, ON     M6J 1H4","Niagara, 82",Designated parking at entrance ; Wheelchair accessible automatic main entrance ; Barrier-free washroom including door and stall,Mon-Fri 8 am-4 pm,,English ; Access to trained interpreters available for French and other languages,No referral necessary but assessment required -- call Access CAMH,"Pharmacotherapy for substance dependence including alcohol, opioid and benzodiazepines * medical assessment * maintenance therapies (methadone and buprenorphine) * concomitant pain and addiction treatment * alcohol use relapse prevention medications * counselling and group therapy * urine drug testing * resource room -- food and housing support, employment support and skills groups * education and training for health professionals and students<br> <br> 

<b>Medical Ambulatory Withdrawal Management</b> -- outpatient alcohol and drug detoxification for individuals 18 years and older * also referrals for those requiring inpatient detoxification",2015-04-20
49,Centre for Addiction and Mental Health,(50) Non Profit ; (51) Registered Charity,Access CAMH (Intake Assessment) 416-535-8501 ext 2,,www.camh.ca,"The Carlos Fidani Family Building
60 White Squirrel Way, 3rd Fl
Toronto, ON     M6J 1H4","Niagara, 82",Designated parking at entrance ; Wheelchair accessible automatic main entrance ; Easy access to elevator ; Barrier-free washroom including door and stall,Mon-Fri 9 am-5 pm,Individuals age 18 and older who primarily use cocaine,English ; Access to trained interpreters available for French and other languages,No referral necessary but assessment required -- call Access CAMH,"Outpatient treatment and aftercare * preparatory, day treatment and continuing care support includes goal planning, relapse prevention and psycho-education group sessions * community integration support includes weekly group counselling for one year post treatment * holistic, harm reduction approach<br><br> 

Provides treatment services to <b>Toronto Drug Treatment Court (DTC)</b> at 100 Stokes St, 3rd Fl -- see separate entry",2015-02-26
50,Centre for Addiction and Mental Health,(50) Non Profit ; (51) Registered Charity,416-535-8501 ext 36071,,www.camh.ca,"The Carlos Fidani Family Building
60 White Squirrel Way, 3rd Fl
Toronto, ON     M6J 1H4","Niagara, 82",Designated parking at entrance ; Wheelchair accessible automatic main entrance ; Barrier-free washroom including door and stall,Admission -- Mon-Fri 8 am-12 noon * no admissions on weekends or public holidays * withdrawal services -- Mon-Sun 24 hours,"Persons requiring inpatient setting and medical support to manage withdrawal symptoms * focus on patients with severe withdrawal symptoms, including seizures and hallucinations",English ; Access to trained interpreters available for French and other languages,Call for information * no referral necessary * telephone assessment/screening required prior to admission,Inpatient alcohol and substance withdrawal management,2015-02-25
51,Centre for Addiction and Mental Health,(50) Non Profit ; (51) Registered Charity,416-535-8501 ext 4366,,www.camh.ca,"Intergenerational Wellness Centre
80 Workman Way
Toronto, ON     M6J 1H4","Niagara, 82",Wheelchair accessible automatic main entrance ; Barrier-free washroom including door and stall,Mon-Fri 9 am-5 pm * individual program hours may vary,"Most programs -- children and youth up to 17 years, with emotional, behavioural, psychological or psychiatric problems, and their families * specific eligibility for some programs -- call for details",English ; Access to trained interpreters available for French and other languages,"Referral required for most programs -- call for details * Child, Youth and Family Referral Form available online * Gender Identity Services not accepting new referrals as current clinic is closing","Assessments, treatment and referrals * treatment recommendations and consultation, including services for those involved with Youth Criminal Justice Act * outreach, prevention and education<br>
<br>
<b>Better Behaviours Service (BBS)</b> -- assessment and treatment for children with behaviour problems, including aggression, social skills difficulties, diminished academic performance and non-compliance * must not have developmental delay, serious medical illness or psychotic disorder * parent programs * individual, group and day treatment programs -- call for eligibility and referral details<br>
<br>
<b>Mood and Anxiety Disorders Service</b> -- assessment, treatment recommendations and short-term treatment * referral required<br>
<br> 
<b>Psychotic Disorders</b> -- assessment and consultation for children and youth with a referral diagnosis of a psychotic disorder or symptoms of psychosis * referral required<br>
<br>
<b>Substance Abuse Program for African Canadian and Caribbean Youth (SAPACCY)</b> -- early intervention and prevention services for Black youth, including individual and group counselling and family support * no referral required<br>
<br>
<b>Toronto Arson Prevention Program for Children (TAPP-C), www.tapp-c.com</b> -- assessment and intervention for children and youth to reduce intentional fire setting or match/lighter play * programs for parents/caregivers * referral required<br>
<br>
<b>Youth Addiction and Concurrent Disorders Service</b> -- assessment and treatment for youth and young adults with substance use challenges, with or without concurrent mental health concerns, and their families * harm reduction and individualized approach * individual and group counselling * case management",2013-02-06
52,Toronto. Hostel Services,(20) Regional Government,Shift Leader 416-392-5452 ; Intake 416-392-5447,,www.toronto.ca/housing/index.htm,"1651 Sheppard Ave W
Toronto, ON     M3M 2X4","Glenfield-Jane Heights, 25",Not Accessible,Mon-Sun 24 hours,Men 18 years and older with a history of using the hostel system,"English ; French ; Intake -- English, French * other languages may be available",Primarily by referral through Seaton House * some referrals through detoxification centres,"Substance abuse recovery program, up to 6 months stay * case management * out patient component * community follow up * aftercare * recreation programs * capacity 30",2016-01-05
53,St Joseph's Health Centre,(50) Non Profit,,,www.stjoe.on.ca,"30 The Queensway
Toronto, ON     M6R 1B5","High Park-Swansea, 87",Wheelchair accessible building including main entrance and barrier free washrooms * designated parking on street and in parking garage,Mon-Sun 24 hours,Men and women 16 years and older,English,Residential program -- call 1-866-366-9513 Central Access * day and community programs -- self referral or call Central Access,"Non-medical day, community and residential alcohol and drug withdrawal management * capacity 26 * 10 crisis beds (3 female, 7 male), 16 program beds (4 female, 12 male) * no smoking * continuing care * family program * assessment and referral * counselling * life skills coaching * smoking cessation program * acupuncture",2016-02-16
54,Debtors Anonymous,(50) Non Profit,289-805-3286,toronto@debtorsanonymous.ca,www.debtorsanonymous.ca,,,Not Applicable - office ; Call for details on meeting locations or visit website,Voice mail,Compulsive debtors * must have desire to stop incurring unsecured debt,English,Call or consult website for meeting locations,12 step recovery groups,2015-05-07
55,JACS Toronto,(50) Non Profit ; (51) Registered Charity,Office 416-638-0350,info@jacstoronto.org,www.jacstoronto.org,"858 Sheppard Ave W
Toronto, ON     M3H 2T5","Bathurst Manor, 34",Wheelchair accessible - call for details,"Office -- Mon-Thu 9 am-5 pm, Fri 9 am-4 pm * winter -- same except Fri 9 am-2 pm","Individuals with addictions and their families, friends and associates in the Jewish community",English ; Hebrew ; Yiddish,"Call, email or visit website","Individual, couple and family counselling for substance abuse issues * resource centre -- addiction education, awareness * confidential telephone information * counselling for teens in crisis * mutual help -- daily 12 step meetings * treatment referrals * recovery retreats * information meetings Thursday 7:30 pm * outreach to schools, camps, youth groups",2014-11-06
56,High Park Chiropractic and Integrated Health,,416-762-7591,highparkhealingarts@gmail.com,www.highparkhealth.com,"2100 Bloor St W, Ste 10
Toronto, ON     M6S 1M7",,,Mon-Fri 8am-6:30pm * Sat 8am-1pm,No restrictions,English,Call or visit,"Community clinic which offers&nbsp;acupuncture, custom foot orthotics, detoxification, family chiropractic, homeopathy, registered massage therapy, naturopathic medicine, nutrition, sports injury management and psychological assessment and psychotherapy",2015-11-09
57,"Yellow Brick Road Holistic Center, Your Path to Total Health",,416-926-1101,info@yellowbrickroad-healthyliving.com,www.yellowbrickroad-healthyliving.com,"258 Dupont St
Toronto, ON     M5R 1V7",,,Reception hours: Mon-Fri 12noon-5pm,No restrictions,English,Call or visit,Holistic health services * specializes in Colonic hydrotherapy and detoxification,2015-07-22
58,Food Addicts in Recovery Anonymous - Toronto - Spadina Ave,(50) Non Profit,416-570-0796<BR>416-857-7559,fa@foodaddicts.org,www.foodaddicts.org,"750 Spadina Ave, Room 301
Toronto, ON     M5S 2J2",,Fully Accessible,Thu 7pm,People 16 years and older * person younger than 16 years must be accompanied by an adult,English,Attend meeting or call for information.,12 step recovery group for&nbsp;people with addictive eating,2015-12-16
59,Ontario Addiction Treatment Centre - Bloor West Clinic,,647-748-6282,info@oatc.ca,www.oatc.ca,"799 Bloor St W
Toronto, ON     M6G 1L8",,Fully Accessible,"Mon 1:30pm-6pm * Tue, Wed 9am-4pm * Fri 9am-3pm",No restrictions,English,Self referral - telephone,Outpatient drug addiction treatment centre * methadone and suboxone treatment&nbsp;program * addiction counseling * medical follow-up * post treatment support,2015-04-29
60,Ontario Addiction Treatment Centre - Danforth,,647-748-8770,info@oatc.ca,www.oatc.ca,"1154 Danforth Ave
Toronto, ON     M4J 1M3",,Fully Accessible,Mon-Fri 8:30am-6pm (Closed 12:30pm-2pm),No restrictions,English,Call or visit,"<a name=""_MailEndCompose"">Outpatient
drug addiction treatment centre * methadone and suboxone treatment program *
addiction counseling * medical follow-up * post treatment support</a><br>",2015-05-12
