,AgencyName,LegalStatus,OfficePhone,EMail,Website,Address,Neighbourhood,Accessibility,Hours,Eligibility,Languages,Application,DescriptionService,DateUpdated
0,Alcoholics Anonymous,(50) Non Profit ; (51) Registered Charity,Support Line 416-487-5591,office@aatoronto.org,www.aatoronto.org,"234 Eglinton Ave E, Ste 202
Toronto, ON     M4P 1K5","Mount Pleasant West, 104","Wheelchair accessible main entrance, assistance needed with door - office ; Barrier-free washroom - office ; Some program locations wheelchair accessible - call or email for information, or visit online directory",Mon-Fri 9 am-5 pm * after hours -- telephone answered by volunteers,Anyone with a desire to stop drinking,"English ; Meetings in other languages may be available - call or email for information, or visit online directory",Attend any open meeting * call or visit website for times and locations or for directory of local groups,Weekly group meetings Monday-Sunday,2015-03-18
1,Toronto Drug Treatment Court,(50) Non Profit,416-973-1314 ; Duty Counsel Office 416-594-9300,,www.tdtc.ca,"Old City Hall
60 Queen St W, Rm 115
Toronto, ON     M5H 2M4","Bay Street Corridor, 76",Barrier-free washroom including door and stall ; Wheelchair accessible automatic rear entrance - from Albert St ; Elevator with lowered control panel,Mon-Fri 8:30 am-4:30 pm,"Non-violent adult offenders who are dependent on cocaine, crack cocaine, heroin or other opiates, or methamphetamine, and have been charged with possession or trafficking of small quantities of crack, cocaine or heroin * may also be charged with minor property crimes or prostitution",English ; interpreters for other languages,"Forms available at court office, online and Duty Counsel office for application assistance * submit completed forms to court office or Crown Counsel, Rm 351","Court Diversion Program -- voluntary court-supervised outpatient drug addiction treatment with case management * graduates receive a non-custodial sentence rather than incarceration *  treatment is provided by the Centre for Addiction and Mental Health (CAMH) at 100 Stokes St, 3rd Fl. * other operating partners include Ontario Court of Justice, Legal Aid Ontario, Toronto Bail Program, additional government ministries and community agencies.",2015-06-15
2,Alpha House,(50) Non Profit ; (51) Registered Charity,416-469-1700,alphahouse@on.aibn.com,alphahouserecovery.ca,"647 Broadview Ave
Toronto, ON     M4K 2N9","North Riverdale, 68",Not Accessible,Office -- Mon-Fri 8:30 am-4:30 pm,Employable men 18 years and older who are alcohol or drug users committed to total abstinence * do not take clients on Methadone or Suboxen,English,"Primarily referrals from detoxification units * also physicians, probation officers, corporations and self referrals",Rehabilitation residence * capacity 18 * staffed 24 hours * self help group attendance mandatory * stay 3 months * support meetings/groups available for non-residents,2014-06-04
3,Bellwood Health Services,(50) Non Profit,416-495-0926,info@bellwood.ca,www.bellwood.ca,"1020 McNicoll Ave
Toronto, ON     M1W 2J6","Steeles, 116",Wheelchair accessible automatic main entrance ; Barrier-free washroom including door and stall,Mon-Sun 24 hours,"Women and men 19 years and older, with alcohol and/or drug addiction, problem gambling, eating disorders, sex addiction, or concurrent trauma and addiction",English,Contact Intake and Assessment * psychosocial interview and medical assessment,"Residential and outpatient addiction treatment, including individual, family and couples counselling",2014-10-15
4,Scarborough Hospital,(50) Non Profit,416-431-8135,,TSH.to,"1225 Kennedy Rd, Unit J
Toronto, ON     M1P 4Y1","Dorset Park, 126",Wheelchair accessible building including main entrance and barrier free washrooms,Mon-Fri 8:30 am-4:30 pm,Persons with severe and persistent mental illness,English,Physician or psychiatrist referral,Psychiatric outpatient program for adults experiencing severe persistent mental illness * assessment and treatment * medication clinics * needle exchange * substance abuse treatment * group and individual treatment,2016-01-05
5,Salvation Army,(50) Non Profit ; (51) Registered Charity,416-431-4379,caroline@salvationarmyhomestead.org,www.salvationarmyhomestead.org,"2085 Ellesmere Rd
Toronto, ON     M1H 2W6","Woburn, 137",Not Accessible,"Office -- Mon-Tue, Fri 9 am-5 pm; Wed-Thu 9:30 am-5:30 pm * program hours vary -- flexible, including days and early evenings","Women and men (including transgender clients) 18 years and older, who identify substance use problems, including clients stabilized on methadone/suboxone * priority to women with children",English,Self or agency referral * call for assessment interview,"Community based day treatment programs -- separate programs for women and men * 10 week program * comprehensive assessment and treatment planning * trauma informed care, counselling * group counselling * case management * addiction education and nicotine replacement therapy * life skills classes * relapse prevention classes * relapse prevention groups * aftercare program * strength-based perspective * spiritual care<br><br>

Supportive housing program * capacity 27",2016-01-05
6,William Osler Health Centre,(50) Non Profit ; (51) Registered Charity,416-494-2120 ext 7,,www.williamoslerhc.on.ca,"101 Humber College Blvd
Toronto, ON     M9V 1R8","West Humber-Clairville, 1",Wheelchair accessible building including main and emergency entrances * barrier free washrooms * designated parking,Mon-Sun 24 hours,,English ; interpretive services,,"Acute care hospital * inpatient and outpatient services * Ontario Breast Screening Program<br><br>
Cardiology * surgery and critical care * mental health and addictions * obstetrics and special care nursery * pediatric inpatient short stay unit * pediatric ambulatory clinics including asthma, diabetes, kidney and sickle cell anemia <br><br>
<a href="" http://www.williamoslerhc.on.ca/patients-and-families/connect-with-osler/find-a-family-doctor""> Family medicine</a> -- list of family physicians affiliated with William Osler Health Centre who are accepting new patients",2014-01-30
7,St Michael's Hospital,(50) Non Profit,Registered patients 416-864-3022 ; New patients intake 416-864-3076,sumac@smh.ca,www.stmichaelshospital.com,"73 Regent Park Blvd, 3rd Fl
Toronto, ON     M5A 2B7","Regent Park, 72",Wheelchair accessible main entrance,"Mon, Thu-Fri 9 am-5 pm, Tue-Wed 9 am-8 pm * doctor on call 24 hours",,English ; Interpretive services,By appointment,General family medicine * nursing * social work * HIV care * prenatal and postnatal care * family practice-based obstetrics * addictions * diet and nutrition * pharmacist,2015-09-24
8,Gamblers Anonymous,(50) Non Profit,GTA Help Line 416-366-7613,intergroup@GamblersAnonymousOntario.org,GamblersAnonymousOntario.org,,,Some locations wheelchair accessible,"Answering service Mon-Sun 24 hours * call, email or visit website for meeting times",,English,"Call, email or visit website for information * email intergroup@GamblersAnonymousToronto.org for Greater Toronto Area chapter","Regular group meetings for men and women who desire to stop gambling * <b>GamAnon</b> -- mutual aid and support for spouse, family or close friends of compulsive gamblers -- online <a href=""http://www.gam-anon.org/meeting-directory/canada-meeting-directory/ontario"">meeting schedule</a> available * meeting locations throughout Toronto",2015-09-30
9,Good Shepherd Ministries,(50) Non Profit ; (51) Registered Charity,416-869-3619,,www.goodshepherd.ca,"412 Queen St E
Toronto, ON     M5A 1T3","Regent Park, 72",Wheelchair accessible building including side entrance and barrier free washrooms,,Homeless and disadvantaged people,English,,"Services for the homeless and disadvantaged 
<br><br>
<b>Meal program</b> for persons who are homeless or disadvantaged Monday-Sunday 2-4 pm * <b>Drop-In Program</b> Monday-Sunday 9-11 am * coffee and snacks * <b>men's clothing</b> distributed 9-11 am, usually Monday-Friday -- call for details<br> <br> 

<b>Medical clinic</b> for persons who are homeless * Monday-Friday -- hours vary, call for details<br> <br> <b>Overnight shelter</b> for men 18 years and older * registration/intake Monday-Sunday 5:30-5:45 pm * capacity 91 * must vacate premises during the day * call for admission and discharge criteria<br> <br> 

<b>Housing workers/resettlement/crisis intervention counselling</b> -- Monday-Friday, by appointment only<br> <br> 

<b>AApricot (Addiction Assessment Psychotherapy Referral in Community of Toronto) program</b>, 416-869-3619 ext 238 -- assess, motivate and refer underserved substance users to appropriate services * Wednesdays 9 am-6 pm * operates in partnership with Fred Victor (see separate entry) and community physicians<br><br>

<b>CATCH (Co-ordinated Access to Care for the Homeless)</b> --for persons who are homeless and not connected to services, with or without mental health or addiction problems * referrals through Medical clinic -- call for details<br><br>

<b>DARE (Drug and Alcohol Recovery Enrichment) Program</b> -- for homeless adult men waiting to enter or who have completed a substance abuse rehabilitation program * referral by detox, rehabilitation centre or social service agency preferred * abstinence-based program<br> <br>

<b>Leave the Streets Behind</b>, 416-869-3619 ext 280 -- case management for homeless veterans * partnership with Veterans Affairs Canada<br><br>
 
<b>Pastoral Care Program</b> -- counselling and support to meet spiritual needs * Monday-Friday 9-5",2015-05-28
10,Humber River Hospital,(50) Non Profit ; (51) Registered Charity,416-242-1000,,www.hrh.ca,"1235 Wilson Ave
Toronto, ON     M3M 0B2","Downsview-Roding-CFB, 26",Unknown,Mon-Sun 24 hours,,English ; telephone service provides access to interpreters for over 140 languages,,"Acute care hospital * medical and surgical inpatient services * diagnostic services * breast screening * breastfeeding clinic * cancer detection and treatment * cardiac care * diabetes education centre * dialysis * gastroenterology * geriatric services * gynecology * neurology* obstetrics * ophthalmology * oral and dental surgery * orthopedics * otolaryngology * palliative care * pediatrics * plastic surgery * respiratory care * speech language pathology * urology<br>
<br>
<b>Mental Health and Addictions Program</b> -- crisis, inpatient and outpatient services for children, adolescents and adults * concurrent disorders * day treatment * early intervention in psychosis * child and adolescent transition day program * Bridgeway Chemical Dependency Program * withdrawal management",2015-10-16
11,LOFT Community Services,(50) Non Profit ; (51) Registered Charity,416-977-6250,ingles@loftcs.org,www.loftcs.org,,,Not Accessible,,"Young women 16-24 years in recovery for addictions, with a goal of abstinence * expected to be employed, or enrolled in a job preparation, education or treatment program during the day * methadone referrals accepted",English,Professional or self referral * phone for application and interview,"High support residence, capacity 9 * staffed 24 hours * abstinent environment * addiction case management * counselling * life skills * anger management * medium or low support transitional peer support housing, capacity 17 * post-discharge community support * voluntary after-care group and weekly supper club",2015-09-08
12,Griffin Centre,(50) Non Profit ; (51) Registered Charity,416-222-1153,contact@griffincentre.org,www.griffincentre.org,"1124 Finch Ave W, Unit 1
Toronto, ON     M3J 2E2","York University Heights, 27",Wheelchair accessible automatic main entrance ; Barrier-free washroom including door and stall ; Designated parking close to entrance,"Mon-Thu 8:30 am-8 pm, Fri 8:30 am-5 pm * after hours -- 24 hour on call service","<b>Mental Health Program</b> -- youth 12-18 years with mental health concerns who are experiencing difficulties at home, school or in the community * <b>Dual Diagnosis Service</b> -- youth 12-18 years with a developmental disability and complex mental health needs, and adults 16 years and older with a developmental disability, with or without accompanying complex mental health needs * <b>reachOUT Newcomer Network</b> -- youth with disabilities and LGBTQ youth 13-24 years, who are permanent residents or government assisted refugees, and their families",English ; Farsi ; Spanish ; Interpretation for other languages arranged,,"Flexible, community-based mental health services * assessment of strengths and needs * individual, family, group and short term counselling * crisis support * substance use treatment * sexual assault harm reduction treatment for offenders (limited capacity) * case management * school-based prevention and consultation * skill development * after school groups * summer work experience opportunities * preparation for independence * youth and family involved in service planning and decisions * consultation for parents, schools, agencies, communities<br><br>

<b>Dual Diagnosis Service (Mental Health/Development Disability)</b> -- assists youth and their families in dealing with conflict with friends or family, problems at school and in the community, discrimination, anger, violence, abuse, substance abuse * day/school support services * respite/residential care<br><br>

<b>Helping Youth Towards Solutions</b> -- harm reduction approach * individual and group counselling * family education and support * outreach to secondary schools * day school support service, in collaboration with Toronto District School Board<br><br>

<b>Mental Health Program</b> -- assists youth and their families in dealing with conflict with friends or family, problems at school and in the community, discrimination, anger, violence, abuse, substance abuse<br><br>

<b>reachOUT</b> -- counselling and support for all youth 12-18 years, and their families * drop-in support groups, outreach, advocacy, workshops, social and recreation activities for LGBTQ youth * <b>Compass</b> -- social group for LGBTQ youth 13-24 years, with or labelled with intellectual disabilities, includes workshops and recreational activities * <b>reachOUT Newcomer Network</b> -- settlement services * community capacity building<br><br>

<b>Transitional Support Services</b> -- day program for adults with developmental disabilities includes life skills and self care, household management, budgeting skills  * residential program -- supported living, 24 hour staff support * capacity 5 * maximum stay up to 2 years<br><br>

Services offered at various locations",2015-06-29
13,Jean Tweed Centre,(50) Non Profit ; (51) Registered Charity,416-255-7359,info@jeantweed.com,www.jeantweed.com,"215 Evans Ave
Toronto, ON     M8Z 1J5","Mimico, 17",Designated parking at entrance ; Wheelchair accessible automatic main entrance ; Barrier-free washroom including door and stall,Office -- Mon-Fri 9 am-5 pm * programs Tue-Thu 9 am-9 pm,"Women 16 years and older who have problems with alcohol, other drugs or problem gambling, and their families * all services available to women on methadone * child development centre -- children 6 years and under",English,Professional or self referral * weekly information session,"Intensive 3 week residential and day treatment program, or individual counselling program over an extended period * pretreatment services and continuing care for 2 years * counselling services for women who have experienced trauma and who have completed the general program * family education and counselling * child care and child development services available * program for women with concurrent disorders currently in the criminal justice system<br><br>

<b>Pathways to Healthy Families</b> -- holistic, culturally responsive outreach program for pregnant or parenting women * service coordination and case management * access to support and counselling (individual, family, group), and child development services<br><br>

Also supportive housing and outreach services for women with mental health and substance abuse problems * all programs trauma informed",2016-01-07
14,Hospital for Sick Children,(50) Non Profit ; (51) Registered Charity,416-813-5804,,www.sickkids.ca/AdolescentMedicine/What-We-Do/index.html,"555 University Ave
Toronto, ON     M5G 1X8","Bay Street Corridor, 76","Wheelchair accessible building including main entrance and barrier free washrooms * braille elevator, lowered buttons",,Children and youth 18 years and under,English ; Interpretive services,Medical referral required,"<b>Eating Disorders Program</b> -- diagnosis and treatment * inpatient and outpatient programs<br><br>
<b>Substance Abuse Day Treatment Program</b> -- harm reduction approach * individual and group treatment * academic program<br><br>
<b>Young Families Program</b> -- for teen parents and their children * well baby care * nutrition and feeding * parenting education",2015-12-29
15,Breakaway Addiction Services,(50) Non Profit ; (51) Registered Charity,416-234-1942,breakaway@breakawayaddictions.ca,www.breakawayaddictions.ca,"21 Strickland Ave
Toronto, ON     M6K 3E6","Roncesvalles, 86",Wheelchair accessible automatic main entrance ; Barrier-free washrooms ; Lot parking ; Community locations vary,"Mon-Thu 9 am-5 pm, Fri 9 am-1 pm * after hours -- by appointment only * individual programs may vary","Varies for individual programs, see below",English,"Self, family, professional or agency referral * will accept collect calls from correctional facilities * <b>Supportive Housing</b> -- apply through Access Point, call 1-888-640-1934 or visit www.theaccesspoint.ca to download application * <b> Opiate Addiction Treatment Services</b> -- call 416-537-9346 or drop in","Comprehensive, community-based, individualized addiction treatment and harm reduction services including street and community outreach<br><br>

<b>Clear Directions Day Treatment Program</b> -- for youth 14-18 years with addictions and mental health problems * school program including academic, therapeutic, and substance use support * in collaboration with George Hull Centre for Children and Families and Toronto District School Board<br><br>

<b>Family and Youth Initiatives</b> -- outpatient treatment for youth 12-24 years with substance abuse related problems, and their families * parent support groups * adult information evenings * groups for youth mandated clients * consultation and supportive assistance to families and significant others when users are not in treatment * community professionals and agency staff -- consultation and training in early identification and management of substance abuse * community education and prevention programs * outreach in some schools<br><br>

<b>Harm Reduction Outreach</b> -- for drug users 12 years and older who are street involved or in conflict with the law * street outreach including counselling, needle exchange, harm reduction supplies, free condoms * outreach to Vanier Centre for Women<br><br>

<b>Opiate Addiction Treatment Services</b> -- outpatient, harm reduction treatment including pharmacotherapies such as methadone, and individual and group counselling * intake and assessment * case management * treatment planning and review * referral and advocacy for housing, employment, social assistance * social and recreation programs<br><br>

<b>Supportive Housing</b> -- for individuals 16 years and older, who have problematic substance use and require stable housing * Housing First Model of supportive housing * engagement in addiction treatment or abstinence not required * in partnership with Regeneration Community Services (see separate entry) <br><br>
 
<b>Toronto Opiate Support Team (TOST)</b> -- for individuals who use opiates or replacement medications, and have little or no access to supportive services (no age restrictions) * case management, counselling and advocacy * flexible ongoing or short term support * training for community service providers * in collaboration with other community agencies * available in various community locations",2015-02-05
16,Narcotics Anonymous Toronto Area,(50) Non Profit,,mail@torontona.org,www.torontona.org,,,Some locations wheelchair accessible,Answering service contacts volunteers on call Mon-Sun 9 am-11 pm; messages can be left 11 pm-9 am,Drug addicts with a desire to stop using all mind altering substances including alcohol,English,Call or visit website for time and place of nearest meeting,12 step recovery program * daily group meetings,2014-11-06
17,Overeaters Anonymous,(50) Non Profit,416-588-6134,info@oaontario.org,www.oaontario.org,"Paulist Ministry Centre
830 Bathurst St
Toronto, ON     M5R 3G1","Annex, 95",Some locations wheelchair accessible - call or visit website for details,"Answering machine, calls usually returned within 48 hours",Compulsive overeaters with a desire to stop eating compulsively,English,"Call, email or visit website",Mutual help group modelled on 12 steps of Alcoholics Anonymous * no weigh-ins or diets * call or visit website for meeting times and locations,2016-02-02
18,Regeneration Community Services,(50) Non Profit ; (51) Registered Charity,416-703-9645,regen@regenerationcs.org,www.regenerationcs.org,"2238 Dundas St W, Ste 307
Toronto, ON     M6R 3A9","Roncesvalles, 86",Wheelchair accessible automatic main entrance ; Some residences wheelchair accessible -- call for details,Mon-Fri 9 am-5 pm,Men and women 16 years and older with a history of long term mental health and/or addiction problems,English,"Apply through Access Point, call 1-888-640-1934 or visit www.theaccesspoint.ca to download application * priority may be given to partner agencies and intake interview may be required","<b>Addiction Supportive Housing</b> -- housing support and case management for persons with severe addiction issues * Managed Alcohol Program -- 24 hour, high-support housing with harm reduction focus<br><br>

<b>Intensive Case Management Program</b> -- case management partnership program with Centre for Addiction and Mental Health and St Joseph's Health Centre Family Health Team (see separate entries) * support services * housing placement<br><br> 

<b>Mental Health Homelessness Initiatives Housing Program</b> -- high support housing * 4 locations * residential and personal care support -- services include meals, laundry, housekeeping, medication management<br><br>

<b>Residential Program</b> -- individualized, voluntary support including assessment, goal setting, skills teaching, resource exploration, linkages, advocacy<br><br>

<b>Step Up Housing</b> -- alternate level of care (ALC) program in partnership with Centre for Addiction and Mental Health * support services include meals, laundry, housekeeping, medication management",2016-01-05
19,Renascent,(50) Non Profit ; (51) Registered Charity,416-927-1202,info@renascent.ca,www.renascent.ca,"Wright Centre
38 Isabella St
Toronto, ON     M4Y 1N1","Church-Yonge Corridor, 75",Wheelchair accessible automatic main entrance ; Elevator with braille and voice/tone features ; Barrier-free washroom including door and stall ; Street parking close to entrance,Office -- Mon-Fri 8:30 am-4:30 pm * Helpline -- Mon-Sun 24 hours,"16 years or older, minimum 72 hours of sobriety, assessment",English,Call Helpline,"Alcoholism and drug addiction recovery programs * complete care -- 21 day primary care, relapse prevention aftercare, alumni care and family care, including children's and parenting programs * residential, outpatient and distant delivery * separate programs for men and women * immediate access * 12 step philosophy * workplace programs * home-like treatment settings",2016-01-05
20,Salvation Army,(50) Non Profit ; (51) Registered Charity,416-255-7070,info@tsa-bss.org,www.tsa-bss.org,"Titan Islington Plaza
1020 Islington Ave, Unit 9A
Toronto, ON     M8Z 6A4","Islington-City Centre West, 14",Unknown,"Mon-Fri 8:30 am-4 pm * after hours on-call support services -- Mon-Fri 4 pm-8:30 am, Sat-Sun and holidays 24 hours","Adults 18 years and older with a mental health disorder, a history of addiction (including concurrent disorder) or previous experience as a mental health services consumer * must have been recently housed, living in precarious housing conditions, or have a history of sporadic housing, and who are willing to live and participate in a cooperative environment",English,"Agency, professional, family or self referral * contact 416-255-7070 ext 256 for information or intake","Outreach agency * wrap around treatment services available to clients in their home or chosen community location * assessment, treatment and care plan development * assistance with housing and shelter * life skills development * medical, crisis and psychiatric support * food, clothing assistance * legal, financial, education and employment counselling * assistance with activities of daily living including personal care, meal preparation, grocery shopping * relationship building, leisure and recreation activities * spiritual counselling",2015-08-05
21,Salvation Army,(50) Non Profit ; (51) Registered Charity,416-363-5496,karen_french@can.salvationarmy.org,www.torontoharbourlight.ca,"160 Jarvis St
Toronto, ON     M5B 2E1","Church-Yonge Corridor, 75",Wheelchair accessible automatic main entrance ; Barrier-free washroom including door and stall ; Street parking close to entrance,Assessment interviews -- Mon-Thu 8 am-4 pm * information Mon-Sun 24 hours,Residential program -- men 18 years and older with concurrent addiction and mental health disorders * Community program -- men 18 years and older who are struggling with substance abuse or dependence,English,Call intake worker,"<b>Residential Treatment Program</b> -- up to 14 weeks * life skills * symptom management * relapse prevention * psychiatric and medical support<br><br>

<b>Community Treatment Program</b> -- flexible group and individual treatment services in downtown Toronto and Scarborough",2015-02-03
